{
  "schemaVersion": "sczn3-target-execution-contract-v1",
  "contractId": "tec-gunfun_22550_5_guys-smart-evidence-v1",
  "contractVersion": "1",
  "authorityContractVersion": "ADR-001-v1",
  "lifecycleStatus": "supported",
  "supportStatus": "supported",
  "approval": {
    "status": "approved",
    "authorityId": "FOUNDER-E56-GUNFUN-FULL-CATALOG-STRESS-AUTHORIZATION-2026-08-19",
    "approvedAt": "2026-08-19T11:14:31-04:00"
  },
  "effective": {
    "from": "2026-08-19T11:14:31-04:00",
    "until": null
  },
  "targetProfile": {
    "id": "gunfun_22550_5_guys",
    "version": "1",
    "atpId": "ATP_GUNFUN_22550_5_GUYS_EVIDENCE_V1",
    "authorityId": "GUNFUN_E56_FULL_CATALOG_AUTHORITY_AUDIT_V1:E56-FC-116",
    "publisher": {
      "id": "gunfun",
      "name": "GunFun Shooting Targets, Inc.",
      "url": "https://gunfun.com/"
    },
    "product": {
      "id": "gunfun-product-22550",
      "name": "5 Guys",
      "sku": "22550",
      "dimensions": {
        "width": 23,
        "height": 35,
        "unit": "inch"
      }
    }
  },
  "components": {
    "geometry": {
      "id": "gunfun_22550_5_guys-geometry",
      "version": "1",
      "status": "approved",
      "definition": {
        "status": "image_plane_evidence_only",
        "coordinateSystem": "normalized_source_image_top_left",
        "canonicalRegionMapping": "unavailable",
        "semanticClassification": "unavailable",
        "physicalMeasurement": "unavailable"
      },
      "digest": "264101163b04c5d6faab229b23c5930f4ecc3a9c8a7deebedf103bd05dbbe9a6"
    },
    "registration": {
      "id": "gunfun_22550_5_guys-registration",
      "version": "1",
      "status": "approved",
      "definition": {
        "role": "evidence_capture_asset",
        "assetPath": "authority-evidence/gunfun/episode56/full-catalog-stress-test/publisher-representations/22550.jpg",
        "assetSha256": "ebec16116791735aeb5c07120617cf42cd8f8f90235e804058107d719c737588",
        "assetAlt": "GunFun 5 Guys, SKU 22550",
        "coordinateConvention": "normalized_source_image_top_left"
      },
      "digest": "48cf24e3945d30e2b497d827b12ba89c63239262a2282e5cdb24ddff354adafc"
    },
    "scoring": {
      "id": "gunfun_22550_5_guys-scoring",
      "version": "1",
      "status": "approved",
      "definition": {
        "status": "not_applicable",
        "reason": "approved_smart_evidence_boundary_does_not_authorize_numeric_scoring"
      },
      "digest": "cf3732ce00c3e638dfd0f0a38ebdd06a3d3e1508de37e2fa356b2c94623eabe7"
    },
    "mission": {
      "id": "gunfun_22550_5_guys-mission",
      "version": "1",
      "status": "approved",
      "definition": {
        "missionFamily": "smartEvidenceCapture",
        "resultPackageType": "smartEvidenceResult",
        "resultPackageVersion": "1",
        "maxObservations": 500,
        "allowShooterDeclaredAim": true,
        "capabilityStates": {
          "evidence": {
            "status": "available"
          },
          "measurement": {
            "status": "unavailable"
          },
          "correction": {
            "status": "unavailable"
          },
          "officialScore": {
            "status": "unavailable"
          },
          "qualification": {
            "status": "not_applicable"
          },
          "publisherMission": {
            "status": "unavailable"
          }
        }
      },
      "digest": "aaaa3194a5b352ed855dc26a318c1f284b24d294d3f7c5e3c0f89b8d4f955a8b"
    }
  },
  "missionFamily": "smartEvidenceCapture",
  "resultPackageType": "smartEvidenceResult",
  "resultPackageVersion": "1",
  "executor": {
    "id": "smart-evidence-capture",
    "version": "1"
  },
  "secAdapter": {
    "id": "smart-evidence-family",
    "version": "1",
    "scoringPresentationFamily": "not_applicable"
  },
  "preservationValidator": {
    "id": "smart-evidence-preservation",
    "version": "1"
  },
  "session": {
    "capabilityStates": {
      "evidence": {
        "status": "available"
      },
      "measurement": {
        "status": "unavailable"
      },
      "correction": {
        "status": "unavailable"
      },
      "officialScore": {
        "status": "unavailable"
      },
      "qualification": {
        "status": "not_applicable"
      },
      "publisherMission": {
        "status": "unavailable"
      }
    },
    "officialMissionRequired": false
  },
  "unsupportedUses": [
    "numeric_scoring",
    "qualification_or_pass_fail",
    "anatomical_medical_tactical_or_diagnostic_interpretation",
    "physical_measurement",
    "zeroing_correction",
    "uncontracted_mission_completion"
  ]
}
