{
  "schemaVersion": "sczn3-target-execution-contract-v1",
  "contractId": "tec-gunfun_23210_tq_19-smart-evidence-v1",
  "contractVersion": "1",
  "authorityContractVersion": "ADR-001-v1",
  "lifecycleStatus": "supported",
  "supportStatus": "supported",
  "approval": {
    "status": "approved",
    "authorityId": "FOUNDER-E56-GUNFUN-FULL-CATALOG-STRESS-AUTHORIZATION-2026-08-19",
    "approvedAt": "2026-08-19T11:14:31-04:00"
  },
  "effective": {
    "from": "2026-08-19T11:14:31-04:00",
    "until": null
  },
  "targetProfile": {
    "id": "gunfun_23210_tq_19",
    "version": "1",
    "atpId": "ATP_GUNFUN_23210_TQ_19_EVIDENCE_V1",
    "authorityId": "GUNFUN_E56_FULL_CATALOG_AUTHORITY_AUDIT_V1:E56-FC-164",
    "publisher": {
      "id": "gunfun",
      "name": "GunFun Shooting Targets, Inc.",
      "url": "https://gunfun.com/"
    },
    "product": {
      "id": "gunfun-product-23210",
      "name": "TQ-19",
      "sku": "23210",
      "dimensions": {
        "width": 23,
        "height": 35,
        "unit": "inch"
      }
    }
  },
  "components": {
    "geometry": {
      "id": "gunfun_23210_tq_19-geometry",
      "version": "1",
      "status": "approved",
      "definition": {
        "status": "image_plane_evidence_only",
        "coordinateSystem": "normalized_source_image_top_left",
        "canonicalRegionMapping": "unavailable",
        "semanticClassification": "unavailable",
        "physicalMeasurement": "unavailable"
      },
      "digest": "8842bf3357b001bdec68b7ca9926104cd08d3c7a411c4d7d2058146e10a386e3"
    },
    "registration": {
      "id": "gunfun_23210_tq_19-registration",
      "version": "1",
      "status": "approved",
      "definition": {
        "role": "evidence_capture_asset",
        "assetPath": "authority-evidence/gunfun/episode56/full-catalog-stress-test/publisher-representations/23210.jpg",
        "assetSha256": "1bded9b95002a2d64e0ec68f017310ac2bf731933bfa6b4ff7013afb52d2fedb",
        "assetAlt": "GunFun TQ-19, SKU 23210",
        "coordinateConvention": "normalized_source_image_top_left"
      },
      "digest": "7fe36f53295e2bde6da00b28a5abb7b924029cae72f96757a129545413a20434"
    },
    "scoring": {
      "id": "gunfun_23210_tq_19-scoring",
      "version": "1",
      "status": "approved",
      "definition": {
        "status": "not_applicable",
        "reason": "approved_smart_evidence_boundary_does_not_authorize_numeric_scoring"
      },
      "digest": "8a3482fca7bad3f632cdaf6024452b819ca9feb9d6336f70f888832687797b30"
    },
    "mission": {
      "id": "gunfun_23210_tq_19-mission",
      "version": "1",
      "status": "approved",
      "definition": {
        "missionFamily": "smartEvidenceCapture",
        "resultPackageType": "smartEvidenceResult",
        "resultPackageVersion": "1",
        "maxObservations": 500,
        "allowShooterDeclaredAim": true,
        "capabilityStates": {
          "evidence": {
            "status": "available"
          },
          "measurement": {
            "status": "unavailable"
          },
          "correction": {
            "status": "unavailable"
          },
          "officialScore": {
            "status": "unavailable"
          },
          "qualification": {
            "status": "not_applicable"
          },
          "publisherMission": {
            "status": "unavailable"
          }
        }
      },
      "digest": "eea8268d3b12962af7f89089d2445fc9f3c625968c30a443b72c9b2b6a5bb6eb"
    }
  },
  "missionFamily": "smartEvidenceCapture",
  "resultPackageType": "smartEvidenceResult",
  "resultPackageVersion": "1",
  "executor": {
    "id": "smart-evidence-capture",
    "version": "1"
  },
  "secAdapter": {
    "id": "smart-evidence-family",
    "version": "1",
    "scoringPresentationFamily": "not_applicable"
  },
  "preservationValidator": {
    "id": "smart-evidence-preservation",
    "version": "1"
  },
  "session": {
    "capabilityStates": {
      "evidence": {
        "status": "available"
      },
      "measurement": {
        "status": "unavailable"
      },
      "correction": {
        "status": "unavailable"
      },
      "officialScore": {
        "status": "unavailable"
      },
      "qualification": {
        "status": "not_applicable"
      },
      "publisherMission": {
        "status": "unavailable"
      }
    },
    "officialMissionRequired": false
  },
  "unsupportedUses": [
    "numeric_scoring",
    "qualification_or_pass_fail",
    "anatomical_medical_tactical_or_diagnostic_interpretation",
    "physical_measurement",
    "zeroing_correction",
    "uncontracted_mission_completion"
  ]
}
