{
  "schemaVersion": "sczn3-target-execution-contract-v1",
  "contractId": "tec-gunfun_32050_b_3_black-smart-evidence-v1",
  "contractVersion": "1",
  "authorityContractVersion": "ADR-001-v1",
  "lifecycleStatus": "supported",
  "supportStatus": "supported",
  "approval": {
    "status": "approved",
    "authorityId": "FOUNDER-E56-GUNFUN-FULL-CATALOG-STRESS-AUTHORIZATION-2026-08-19",
    "approvedAt": "2026-08-19T11:14:31-04:00"
  },
  "effective": {
    "from": "2026-08-19T11:14:31-04:00",
    "until": null
  },
  "targetProfile": {
    "id": "gunfun_32050_b_3_black",
    "version": "1",
    "atpId": "ATP_GUNFUN_32050_B_3_BLACK_EVIDENCE_V1",
    "authorityId": "GUNFUN_E56_FULL_CATALOG_AUTHORITY_AUDIT_V1:E56-FC-186",
    "publisher": {
      "id": "gunfun",
      "name": "GunFun Shooting Targets, Inc.",
      "url": "https://gunfun.com/"
    },
    "product": {
      "id": "gunfun-product-32050",
      "name": "B-3 Black",
      "sku": "32050",
      "dimensions": {
        "width": 9.5,
        "height": 12,
        "unit": "inch"
      }
    }
  },
  "components": {
    "geometry": {
      "id": "gunfun_32050_b_3_black-geometry",
      "version": "1",
      "status": "approved",
      "definition": {
        "status": "image_plane_evidence_only",
        "coordinateSystem": "normalized_source_image_top_left",
        "canonicalRegionMapping": "unavailable",
        "semanticClassification": "unavailable",
        "physicalMeasurement": "unavailable"
      },
      "digest": "fe7a85435c2f9c6e5fff2ca0b2fca68b2682878ff04b9d2900fd00c7b64140fc"
    },
    "registration": {
      "id": "gunfun_32050_b_3_black-registration",
      "version": "1",
      "status": "approved",
      "definition": {
        "role": "evidence_capture_asset",
        "assetPath": "authority-evidence/gunfun/episode56/full-catalog-stress-test/publisher-representations/32050.jpg",
        "assetSha256": "de3bd861549b4c38cde5714f05529a882fbf92510148478802c0c184e7761ba1",
        "assetAlt": "GunFun B-3 Black, SKU 32050",
        "coordinateConvention": "normalized_source_image_top_left"
      },
      "digest": "97fe50d12c3973ee3510adf53f8b035abdddb2f2c35dc8cf6d672b8cd38f761d"
    },
    "scoring": {
      "id": "gunfun_32050_b_3_black-scoring",
      "version": "1",
      "status": "approved",
      "definition": {
        "status": "not_applicable",
        "reason": "approved_smart_evidence_boundary_does_not_authorize_numeric_scoring"
      },
      "digest": "58d2476deb749109e2b4aa29616fc21a0cf0593d456c0128cd03508f886c36e4"
    },
    "mission": {
      "id": "gunfun_32050_b_3_black-mission",
      "version": "1",
      "status": "approved",
      "definition": {
        "missionFamily": "smartEvidenceCapture",
        "resultPackageType": "smartEvidenceResult",
        "resultPackageVersion": "1",
        "maxObservations": 500,
        "allowShooterDeclaredAim": true,
        "capabilityStates": {
          "evidence": {
            "status": "available"
          },
          "measurement": {
            "status": "unavailable"
          },
          "correction": {
            "status": "unavailable"
          },
          "officialScore": {
            "status": "unavailable"
          },
          "qualification": {
            "status": "not_applicable"
          },
          "publisherMission": {
            "status": "unavailable"
          }
        }
      },
      "digest": "3bc5e8156c72a9be2acbdfe5fec37d372be1a73ea30a4b1544a44ffeaea0eead"
    }
  },
  "missionFamily": "smartEvidenceCapture",
  "resultPackageType": "smartEvidenceResult",
  "resultPackageVersion": "1",
  "executor": {
    "id": "smart-evidence-capture",
    "version": "1"
  },
  "secAdapter": {
    "id": "smart-evidence-family",
    "version": "1",
    "scoringPresentationFamily": "not_applicable"
  },
  "preservationValidator": {
    "id": "smart-evidence-preservation",
    "version": "1"
  },
  "session": {
    "capabilityStates": {
      "evidence": {
        "status": "available"
      },
      "measurement": {
        "status": "unavailable"
      },
      "correction": {
        "status": "unavailable"
      },
      "officialScore": {
        "status": "unavailable"
      },
      "qualification": {
        "status": "not_applicable"
      },
      "publisherMission": {
        "status": "unavailable"
      }
    },
    "officialMissionRequired": false
  },
  "unsupportedUses": [
    "numeric_scoring",
    "qualification_or_pass_fail",
    "anatomical_medical_tactical_or_diagnostic_interpretation",
    "physical_measurement",
    "zeroing_correction",
    "uncontracted_mission_completion"
  ]
}
