{
  "schemaVersion": "sczn3-target-execution-contract-v1",
  "contractId": "tec-gunfun_22670_b27e_white_red_black-smart-evidence-v1",
  "contractVersion": "1",
  "authorityContractVersion": "ADR-001-v1",
  "lifecycleStatus": "supported",
  "supportStatus": "supported",
  "approval": {
    "status": "approved",
    "authorityId": "FOUNDER-E56-GUNFUN-FULL-CATALOG-STRESS-AUTHORIZATION-2026-08-19",
    "approvedAt": "2026-08-19T11:14:31-04:00"
  },
  "effective": {
    "from": "2026-08-19T11:14:31-04:00",
    "until": null
  },
  "targetProfile": {
    "id": "gunfun_22670_b27e_white_red_black",
    "version": "1",
    "atpId": "ATP_GUNFUN_22670_B27E_WHITE_RED_BLACK_EVIDENCE_V1",
    "authorityId": "GUNFUN_E56_FULL_CATALOG_AUTHORITY_AUDIT_V1:E56-FC-124",
    "publisher": {
      "id": "gunfun",
      "name": "GunFun Shooting Targets, Inc.",
      "url": "https://gunfun.com/"
    },
    "product": {
      "id": "gunfun-product-22670",
      "name": "B27E White/Red/Black",
      "sku": "22670",
      "dimensions": {
        "width": 23,
        "height": 35,
        "unit": "inch"
      }
    }
  },
  "components": {
    "geometry": {
      "id": "gunfun_22670_b27e_white_red_black-geometry",
      "version": "1",
      "status": "approved",
      "definition": {
        "status": "image_plane_evidence_only",
        "coordinateSystem": "normalized_source_image_top_left",
        "canonicalRegionMapping": "unavailable",
        "semanticClassification": "unavailable",
        "physicalMeasurement": "unavailable"
      },
      "digest": "8100351d8bb4a96bf5183cf288f72af3dc04973eebfa7a72ce659e2266ad8551"
    },
    "registration": {
      "id": "gunfun_22670_b27e_white_red_black-registration",
      "version": "1",
      "status": "approved",
      "definition": {
        "role": "evidence_capture_asset",
        "assetPath": "authority-evidence/gunfun/episode56/full-catalog-stress-test/publisher-representations/22670.jpg",
        "assetSha256": "0f8a0ad893745cc583ffc708b81cdb41acfaffe65ff94f375cbfb4451f0e7c64",
        "assetAlt": "GunFun B27E White/Red/Black, SKU 22670",
        "coordinateConvention": "normalized_source_image_top_left"
      },
      "digest": "b7135b00c3d9184a32a28fa369b6665b81d6db247b3a72af3cf674669b2bdb46"
    },
    "scoring": {
      "id": "gunfun_22670_b27e_white_red_black-scoring",
      "version": "1",
      "status": "approved",
      "definition": {
        "status": "not_applicable",
        "reason": "approved_smart_evidence_boundary_does_not_authorize_numeric_scoring"
      },
      "digest": "f00f1015f3523a96333d2701c91bc0b601fc2070fde8a57c9bdade1b5fb60525"
    },
    "mission": {
      "id": "gunfun_22670_b27e_white_red_black-mission",
      "version": "1",
      "status": "approved",
      "definition": {
        "missionFamily": "smartEvidenceCapture",
        "resultPackageType": "smartEvidenceResult",
        "resultPackageVersion": "1",
        "maxObservations": 500,
        "allowShooterDeclaredAim": true,
        "capabilityStates": {
          "evidence": {
            "status": "available"
          },
          "measurement": {
            "status": "unavailable"
          },
          "correction": {
            "status": "unavailable"
          },
          "officialScore": {
            "status": "unavailable"
          },
          "qualification": {
            "status": "not_applicable"
          },
          "publisherMission": {
            "status": "unavailable"
          }
        }
      },
      "digest": "583ffeb8c1a5f916f745758f5716579bd28432821595d933aaade93dbb13f13f"
    }
  },
  "missionFamily": "smartEvidenceCapture",
  "resultPackageType": "smartEvidenceResult",
  "resultPackageVersion": "1",
  "executor": {
    "id": "smart-evidence-capture",
    "version": "1"
  },
  "secAdapter": {
    "id": "smart-evidence-family",
    "version": "1",
    "scoringPresentationFamily": "not_applicable"
  },
  "preservationValidator": {
    "id": "smart-evidence-preservation",
    "version": "1"
  },
  "session": {
    "capabilityStates": {
      "evidence": {
        "status": "available"
      },
      "measurement": {
        "status": "unavailable"
      },
      "correction": {
        "status": "unavailable"
      },
      "officialScore": {
        "status": "unavailable"
      },
      "qualification": {
        "status": "not_applicable"
      },
      "publisherMission": {
        "status": "unavailable"
      }
    },
    "officialMissionRequired": false
  },
  "unsupportedUses": [
    "numeric_scoring",
    "qualification_or_pass_fail",
    "anatomical_medical_tactical_or_diagnostic_interpretation",
    "physical_measurement",
    "zeroing_correction",
    "uncontracted_mission_completion"
  ]
}
