{
  "schemaVersion": "sczn3-target-execution-contract-v1",
  "contractId": "tec-gunfun_82030_100_yd_rifle_target-smart-evidence-v1",
  "contractVersion": "1",
  "authorityContractVersion": "ADR-001-v1",
  "lifecycleStatus": "supported",
  "supportStatus": "supported",
  "approval": {
    "status": "approved",
    "authorityId": "FOUNDER-E56-GUNFUN-FULL-CATALOG-STRESS-AUTHORIZATION-2026-08-19",
    "approvedAt": "2026-08-19T11:14:31-04:00"
  },
  "effective": {
    "from": "2026-08-19T11:14:31-04:00",
    "until": null
  },
  "targetProfile": {
    "id": "gunfun_82030_100_yd_rifle_target",
    "version": "1",
    "atpId": "ATP_GUNFUN_82030_100_YD_RIFLE_TARGET_EVIDENCE_V1",
    "authorityId": "GUNFUN_E56_FULL_CATALOG_AUTHORITY_AUDIT_V1:E56-FC-242",
    "publisher": {
      "id": "gunfun",
      "name": "GunFun Shooting Targets, Inc.",
      "url": "https://gunfun.com/"
    },
    "product": {
      "id": "gunfun-product-82030",
      "name": "100 Yd Rifle Target",
      "sku": "82030",
      "dimensions": {
        "width": 14,
        "height": 20,
        "unit": "inch"
      }
    }
  },
  "components": {
    "geometry": {
      "id": "gunfun_82030_100_yd_rifle_target-geometry",
      "version": "1",
      "status": "approved",
      "definition": {
        "status": "image_plane_evidence_only",
        "coordinateSystem": "normalized_source_image_top_left",
        "canonicalRegionMapping": "unavailable",
        "semanticClassification": "unavailable",
        "physicalMeasurement": "unavailable"
      },
      "digest": "d529f64c0b2423292a8a005fb8f60ea285e88a33860e2c27bc0b0c20a6210988"
    },
    "registration": {
      "id": "gunfun_82030_100_yd_rifle_target-registration",
      "version": "1",
      "status": "approved",
      "definition": {
        "role": "evidence_capture_asset",
        "assetPath": "authority-evidence/gunfun/episode56/full-catalog-stress-test/publisher-representations/82030.jpg",
        "assetSha256": "52303a3704bbbca27dec2117914470e99ec5f0fb9169293c2938952951b9929b",
        "assetAlt": "GunFun 100 Yd Rifle Target, SKU 82030",
        "coordinateConvention": "normalized_source_image_top_left"
      },
      "digest": "d09a9c5b5e447acf349e477dcb68f36eff928948aef0c8d46eba21667bbcec0b"
    },
    "scoring": {
      "id": "gunfun_82030_100_yd_rifle_target-scoring",
      "version": "1",
      "status": "approved",
      "definition": {
        "status": "not_applicable",
        "reason": "approved_smart_evidence_boundary_does_not_authorize_numeric_scoring"
      },
      "digest": "fb7afc2cf6edb413143dcabd8c586e756687f5b999b41e3bddac6d13e4b69f44"
    },
    "mission": {
      "id": "gunfun_82030_100_yd_rifle_target-mission",
      "version": "1",
      "status": "approved",
      "definition": {
        "missionFamily": "smartEvidenceCapture",
        "resultPackageType": "smartEvidenceResult",
        "resultPackageVersion": "1",
        "maxObservations": 500,
        "allowShooterDeclaredAim": true,
        "capabilityStates": {
          "evidence": {
            "status": "available"
          },
          "measurement": {
            "status": "unavailable"
          },
          "correction": {
            "status": "unavailable"
          },
          "officialScore": {
            "status": "unavailable"
          },
          "qualification": {
            "status": "not_applicable"
          },
          "publisherMission": {
            "status": "unavailable"
          }
        }
      },
      "digest": "ed9964e0f0e42f080c746299083d85137e63d4ad7dd5af334afcd41f2ddea9ea"
    }
  },
  "missionFamily": "smartEvidenceCapture",
  "resultPackageType": "smartEvidenceResult",
  "resultPackageVersion": "1",
  "executor": {
    "id": "smart-evidence-capture",
    "version": "1"
  },
  "secAdapter": {
    "id": "smart-evidence-family",
    "version": "1",
    "scoringPresentationFamily": "not_applicable"
  },
  "preservationValidator": {
    "id": "smart-evidence-preservation",
    "version": "1"
  },
  "session": {
    "capabilityStates": {
      "evidence": {
        "status": "available"
      },
      "measurement": {
        "status": "unavailable"
      },
      "correction": {
        "status": "unavailable"
      },
      "officialScore": {
        "status": "unavailable"
      },
      "qualification": {
        "status": "not_applicable"
      },
      "publisherMission": {
        "status": "unavailable"
      }
    },
    "officialMissionRequired": false
  },
  "unsupportedUses": [
    "numeric_scoring",
    "qualification_or_pass_fail",
    "anatomical_medical_tactical_or_diagnostic_interpretation",
    "physical_measurement",
    "zeroing_correction",
    "uncontracted_mission_completion"
  ]
}
