{
  "schemaVersion": "sczn3-target-execution-contract-v1",
  "contractId": "tec-gunfun_53620_shotgun_target-smart-evidence-v1",
  "contractVersion": "1",
  "authorityContractVersion": "ADR-001-v1",
  "lifecycleStatus": "supported",
  "supportStatus": "supported",
  "approval": {
    "status": "approved",
    "authorityId": "FOUNDER-E56-B2-AUTHORIZATION-2026-08-19",
    "approvedAt": "2026-08-19T10:33:13-04:00"
  },
  "effective": {
    "from": "2026-08-19T10:33:13-04:00",
    "until": null
  },
  "targetProfile": {
    "id": "gunfun_53620_shotgun_target",
    "version": "1",
    "atpId": "ATP_GUNFUN_53620_SHOTGUN_TARGET_EVIDENCE_V1",
    "authorityId": "GUNFUN_E56_BATCH2_AUTHORITY_AUDIT_V1:E56-B2-T02",
    "publisher": {
      "id": "gunfun",
      "name": "GunFun Shooting Targets, Inc.",
      "url": "https://gunfun.com/"
    },
    "product": {
      "id": "gunfun-product-53620",
      "name": "Shotgun Target",
      "sku": "53620",
      "dimensions": {
        "width": 28,
        "height": 28,
        "unit": "inch"
      }
    }
  },
  "components": {
    "geometry": {
    "id": "gunfun_53620_shotgun_target-geometry",
    "version": "1",
    "status": "approved",
    "digest": "2ce9c37f84c8904da6beb67033ff254ec8b518dff35980fd2d6e847ba101733a",
      "definition": {
        "status": "image_plane_evidence_only",
        "coordinateSystem": "normalized_source_image_top_left",
        "canonicalRegionMapping": "unavailable",
        "semanticClassification": "unavailable",
        "physicalMeasurement": "unavailable"
      }
    },
    "registration": {
    "id": "gunfun_53620_shotgun_target-registration",
    "version": "1",
    "status": "approved",
    "digest": "a62a9ec06a1e8e3a6d5fdc585aa26240a1302559dcf0bb21af1d76ebfdda95ec",
      "definition": {
        "role": "evidence_capture_asset",
        "assetPath": "authority-evidence/gunfun/episode56/batch2/publisher-representations/53620.jpg",
        "assetSha256": "f3e2e7c79db81c01645f90ea8a2f6af9f6ac676f760bfc8ca0bcea655847bf72",
        "assetAlt": "GunFun Shotgun Target, SKU 53620",
        "coordinateConvention": "normalized_source_image_top_left"
      }
    },
    "scoring": {
    "id": "gunfun_53620_shotgun_target-scoring",
    "version": "1",
    "status": "approved",
    "digest": "574022516d7afe3a3c052b6008f23b593b0bddab767b7243c61879dda5a24618",
      "definition": {
        "status": "not_applicable",
        "reason": "approved_smart_evidence_boundary_does_not_authorize_numeric_scoring"
      }
    },
    "mission": {
    "id": "gunfun_53620_shotgun_target-mission",
    "version": "1",
    "status": "approved",
    "digest": "0ef446ff802a720988b3f20539aefc4d42620363532af0a64096aa7c62d96da9",
      "definition": {
        "missionFamily": "smartEvidenceCapture",
        "resultPackageType": "smartEvidenceResult",
        "resultPackageVersion": "1",
        "maxObservations": 500,
        "allowShooterDeclaredAim": true,
        "capabilityStates": {
          "evidence": {
            "status": "available"
          },
          "measurement": {
            "status": "unavailable"
          },
          "correction": {
            "status": "unavailable"
          },
          "officialScore": {
            "status": "not_applicable"
          },
          "qualification": {
            "status": "not_applicable"
          },
          "publisherMission": {
            "status": "not_applicable"
          }
        }
      }
    }
  },
  "missionFamily": "smartEvidenceCapture",
  "resultPackageType": "smartEvidenceResult",
  "resultPackageVersion": "1",
  "executor": {
    "id": "smart-evidence-capture",
    "version": "1"
  },
  "secAdapter": {
    "id": "smart-evidence-family",
    "version": "1",
    "scoringPresentationFamily": "not_applicable"
  },
  "preservationValidator": {
    "id": "smart-evidence-preservation",
    "version": "1"
  },
  "session": {
    "capabilityStates": {
      "evidence": {
        "status": "available"
      },
      "measurement": {
        "status": "unavailable"
      },
      "correction": {
        "status": "unavailable"
      },
      "officialScore": {
        "status": "not_applicable"
      },
      "qualification": {
        "status": "not_applicable"
      },
      "publisherMission": {
        "status": "not_applicable"
      }
    },
    "officialMissionRequired": false
  },
  "unsupportedUses": [
    "numeric_scoring",
    "qualification_or_pass_fail",
    "anatomical_medical_tactical_or_diagnostic_interpretation",
    "physical_measurement",
    "zeroing_correction",
    "uncontracted_mission_completion"
  ]
}
